{"metadata_version": "1.0.0", "status": "completed", "note": "fixture completed run", "provider": "test-provider", "model": "TestModel", "model_snapshot": null, "client": "pytest", "client_version": null, "reasoning_effort": "high", "temperature": null, "seed": null, "started_at": "2026-07-10T12:00:00Z", "completed_at": "2026-07-10T12:05:00Z", "prompt_sha256": "ec9dc6c6d8f29a806c9b7687f2578c415653f29049d5bbe540749bf86b88f140", "runtime_pack_sha256": "cbc5afebbf86ea5e259613f2b4754ff5477ebb05386ed0b55a9fe0d7590c6048", "problem_material_digest": "aaaaaaaaaaaaaaaaaaaaaaaaaaaaaaaaaaaaaaaaaaaaaaaaaaaaaaaaaaaaaaaa", "tool_permissions": [], "working_directory_mode": "isolated"}
