{"metadata_version": "1.0.0", "status": "completed", "note": "待填写真实运行数据；pending 元数据不能作为晋级证据。", "provider": "fixture", "model": "BaseFixtureModel", "model_snapshot": null, "client": null, "client_version": null, "reasoning_effort": null, "temperature": null, "seed": null, "started_at": null, "completed_at": null, "prompt_sha256": null, "runtime_pack_sha256": null, "problem_material_digest": null, "tool_permissions": null, "working_directory_mode": null}